{"compiler_version":"pwg.prompt_compiler.v1","dependency_hashes":{"denylist":"30dcd45b9b92f8c815c120654bb69ce393fae5006bd91356adbde28e3f05e4eb","det_gate":"fffc2bbe2b73e36d311b4e0639b6f31f122a14355e2e846343af95d8a346d4be","h2676_manifest":"8d0401a92f58cba6af5a25d979af9e8ccbea92d79307764dfbf303e9a4c042b4","h2676_payload":"2d780f936e21c5c9875747076427d07dafd3021ad9130fdafb4e54d50193b7d2","h2676_sample":"0604ce8d32cae07d8af1ef41a2ed2c5fec2125df40c73182c1d6e3d9acea912c","tm":"b521163bd3b286be6c963797ff79333d537f6ee6526e3210414944ce0aca47d0"},"generation_parameters":{"max_tokens":32768,"reasoning_effort":"high","response_format":{"type":"json_object"},"temperature":0.2},"parent_request_id":null,"promotable":false,"provider":"deepseek","repair_variant":null,"request_id":"7584a30a8fb86b8652e298c65a5b5c0a038167a45fc5dc22b830eed1f7750e87","requested_model":"deepseek-v4-pro","response_schema_sha256":"63b2a061145ea9657ec4df654e2ef907c36f1bcc2263431b0d7965687e418f56","schema":"pwg.cache_request.v1","source_card_sha256":"dd93a6abae5a550e8da3de6f45e0dd7c3f82336a2b87a50dfa61928ba4fc0ebf","source_fragment_sha256":null,"stable_prefix_sha256":"8d2fdb80854f861521c3164f405ff3d21155e1c342d3cae3d4ea67afc4e3b21b","volatile_tail_sha256":"dd93a6abae5a550e8da3de6f45e0dd7c3f82336a2b87a50dfa61928ba4fc0ebf"}
