{"compiler_version":"pwg.prompt_compiler.v1","dependency_hashes":{"denylist":"30dcd45b9b92f8c815c120654bb69ce393fae5006bd91356adbde28e3f05e4eb","h2675_report":"fe7478f4ddd57b321cb03a52e80c76191204b993e9743ef75313aaf2c0022431","prep_pack":"5d979b39519a7015aa9a447022f53dd005d8535724ef92a5e9bef6274b77b1ce","prep_schema":"d14e142bffd81222ce8d4982eff3eca2210821bc4d3dc785607be1211b366c85","tm":"b521163bd3b286be6c963797ff79333d537f6ee6526e3210414944ce0aca47d0"},"generation_parameters":{"max_tokens":32768,"reasoning_effort":null,"response_format":{"type":"json_object"}},"parent_request_id":null,"promotable":false,"provider":"deepseek","repair_variant":null,"request_id":"73e6b3ee29adbc04f99ed4c449c62be483e4508c6e4dd9bea3b9356bc9bee76f","requested_model":"deepseek-v4-flash","response_schema_sha256":"c5a1f947a5b5a0b7936c5953090c2cbcc2608723974e1dbf7af62db78b588ed5","schema":"pwg.cache_request.v1","source_card_sha256":"bb1d93d39b2c69f9865e62f30d380a8b10aa2dc2a54ae852f64a149caaff524b","source_fragment_sha256":null,"stable_prefix_sha256":"0b902afd51a9794db2480b01c1cdbd96b74595bc55dd3dae1685855d767156ef","volatile_tail_sha256":"bb1d93d39b2c69f9865e62f30d380a8b10aa2dc2a54ae852f64a149caaff524b"}
